{
  "$schema":"https://json-schema.org/draft/2020-12/schema",
  "title":"TL1 Catalog (array)",
  "type":"array",
  "items":{
    "type":"object",
    "required":["command_id","command_code","command_name","syntax"],
    "properties":{
      "command_id":{"type":"string"},
      "command_code":{"type":"string"},
      "command_name":{"type":"string"},
      "category":{"type":"string"},
      "subcategory":{"type":"string"},
      "applicable_models":{"type":"array","items":{"type":"string"}},
      "syntax":{"type":"string"},
      "parameters":{"type":"object"},
      "response_format":{"type":"object"},
      "safety_level":{"type":"string"},
      "service_affecting":{"type":"boolean"}
    },
    "additionalProperties":true
  }
}
