[
  {
    "command_id": "ENT-PMGRP_001",
    "command_code": "ENT-PMGRP",
    "command_name": "Enable PM Group",
    "category": "Performance",
    "subcategory": "Scheduling",
    "applicable_models": ["SM","SMX"],
    "syntax": "ENT-PMGRP:[tid]:[grp]:[ctag]::AID=[aid],PERIOD=[15M|1H|24H],ALIGN=[NOW|HHMM];",
    "parameters": {
      "grp": {"required": true, "description": "PM group name"},
      "aid": {"required": true, "description": "Target facility or ALL"},
      "PERIOD": {"required": true, "values": ["15M","1H","24H"]},
      "ALIGN": {"required": false, "values": ["NOW","HHMM"]}
    },
    "response_format": { "completion_codes": ["COMPLD","DENY","PRTL"] },
    "safety_level": "safe",
    "service_affecting": false
  },
  {
    "command_id": "ED-PMGRP_001",
    "command_code": "ED-PMGRP",
    "command_name": "Edit PM Group",
    "category": "Performance",
    "subcategory": "Scheduling",
    "applicable_models": ["SM","SMX"],
    "syntax": "ED-PMGRP:[tid]:[grp]:[ctag]::AID=[aid],PERIOD=[..],STATE=[IS|OOS];",
    "safety_level": "safe",
    "service_affecting": false
  },
  {
    "command_id": "RLS-PMGRP_001",
    "command_code": "RLS-PMGRP",
    "command_name": "Disable PM Group",
    "category": "Performance",
    "subcategory": "Scheduling",
    "applicable_models": ["SM","SMX"],
    "syntax": "RLS-PMGRP:[tid]:[grp]:[ctag]::AID=[aid];",
    "safety_level": "safe",
    "service_affecting": false
  },
  {
    "command_id": "RTRV-PM_001",
    "command_code": "RTRV-PM",
    "command_name": "Retrieve PM Current",
    "category": "Performance",
    "subcategory": "Read",
    "applicable_models": ["SM","SMX"],
    "syntax": "RTRV-PM:[tid]:aid:[ctag]::BIN=[CUR|HIST],PERIOD=[15M|1H|24H],BINS=[N];",
    "parameters": {
      "aid": {"required": true},
      "BIN": {"values": ["CUR","HIST"]},
      "PERIOD": {"values": ["15M","1H","24H"]}
    },
    "response_format": { "body_fields": ["AID","PARAM","VALUE","BIN","PERIOD","ENDTIME"] },
    "safety_level": "safe",
    "service_affecting": false
  },
  {
    "command_id": "RTRV-PM-HIST_001",
    "command_code": "RTRV-PM-HIST",
    "command_name": "Retrieve PM History",
    "category": "Performance",
    "subcategory": "Read",
    "applicable_models": ["SM","SMX"],
    "syntax": "RTRV-PM-HIST:[tid]:aid:[ctag]::PERIOD=[..],RANGE=[YYYYMMDDHH-YYYYMMDDHH];",
    "safety_level": "safe",
    "service_affecting": false
  }
]
