[
  {
    "command_id": "ENT-CRS-VT1_001",
    "command_code": "ENT-CRS-VT1",
    "command_name": "Enter VT1.5 Cross-Connect",
    "category": "Cross-Connects",
    "subcategory": "VT",
    "applicable_models": ["SM","SMX"],
    "syntax": "ENT-CRS-VT1:[tid]:[ctag]::AID1=[from],AID2=[to],DIR=[2W|1W],SIG=[DS1],BWC=[LO];",
    "parameters": {
      "from": {"required": true, "description": "Source VT1.5"},
      "to": {"required": true, "description": "Sink VT1.5"},
      "DIR": {"values": ["2W","1W"]},
      "SIG": {"values": ["DS1","VT1"]},
      "BWC": {"values": ["LO","HI"]}
    },
    "safety_level": "caution",
    "service_affecting": true
  },
  {
    "command_id": "ENT-CRS-STS1_001",
    "command_code": "ENT-CRS-STS1",
    "command_name": "Enter STS-1 Cross-Connect",
    "category": "Cross-Connects",
    "subcategory": "STS",
    "applicable_models": ["SM","SMX"],
    "syntax": "ENT-CRS-STS1:[tid]:[ctag]::AID1=[from],AID2=[to],DIR=[2W|1W];",
    "safety_level": "caution",
    "service_affecting": true
  },
  {
    "command_id": "DLT-CRS_001",
    "command_code": "DLT-CRS",
    "command_name": "Delete Cross-Connect",
    "category": "Cross-Connects",
    "subcategory": "General",
    "applicable_models": ["SM","SMX"],
    "syntax": "DLT-CRS:[tid]:[ctag]::AID1=[from],AID2=[to];",
    "safety_level": "caution",
    "service_affecting": true
  },
  {
    "command_id": "RTRV-CRS_001",
    "command_code": "RTRV-CRS",
    "command_name": "Retrieve Cross-Connects",
    "category": "Cross-Connects",
    "subcategory": "Read",
    "applicable_models": ["SM","SMX"],
    "syntax": "RTRV-CRS:[tid]:[ctag]::AID=[aid|ALL],SIG=[DS1|STS1|VT1],DIR=[2W|1W];",
    "safety_level": "safe",
    "service_affecting": false
  }
]
